{
  "schema_version": 1,
  "id": "arc.mobile.safe-demo",
  "name": "ARC Mobile Safe Demo",
  "version": "0.1.0",
  "description": "Small safe mock-only mobile capability manifest for CLI tests and docs.",
  "platforms": [
    { "platform": "expo", "min_os_version": null, "stub_only": true, "framework": "expo" },
    { "platform": "flutter", "min_os_version": null, "stub_only": true, "framework": "flutter" },
    { "platform": "react_native", "min_os_version": null, "stub_only": true, "framework": "react_native" }
  ],
  "capabilities": [
    {
      "schema_version": 1,
      "id": "app.memory.write.mock",
      "name": "App Memory Write (Mock)",
      "description": "Simulated in-app memory write; no real storage outside fixtures.",
      "category": "app",
      "platforms": ["all"],
      "required_permissions": [],
      "approval_mode": "none",
      "data_sensitivity": "low",
      "reads": false,
      "writes": true,
      "network": false,
      "paid": false,
      "background": false,
      "replayable": true,
      "auditable": true,
      "mcp_exposable": false,
      "simulator_supported": true,
      "test_fixture_supported": true,
      "requires_trust": true,
      "requires_hitl": false,
      "metadata": {}
    },
    {
      "schema_version": 1,
      "id": "app.memory.retrieve.mock",
      "name": "App Memory Retrieve (Mock)",
      "description": "Simulated in-app memory retrieval; no real user data.",
      "category": "app",
      "platforms": ["all"],
      "required_permissions": [],
      "approval_mode": "none",
      "data_sensitivity": "low",
      "reads": true,
      "writes": false,
      "network": false,
      "paid": false,
      "background": false,
      "replayable": true,
      "auditable": true,
      "mcp_exposable": false,
      "simulator_supported": true,
      "test_fixture_supported": true,
      "requires_trust": false,
      "requires_hitl": false,
      "metadata": {}
    }
  ],
  "background_execution": false,
  "network_by_default": false,
  "simulator_mode": true,
  "privacy_manifest": true
}
